{
  "$schema": "http://json-schema.org/draft-07/schema#",
  "$id": "https://mise/schemas/recipe_schema.json",
  "title": "Recipe",
  "type": "object",
  "additionalProperties": false,
  "required": [
    "title",
    "base_servings",
    "ingredients",
    "steps",
    "tags",
    "source",
    "created_at"
  ],
  "properties": {
    "title": { "type": "string", "minLength": 1 },
    "base_servings": { "type": "integer", "minimum": 1 },
    "ingredients": {
      "type": "array",
      "minItems": 1,
      "items": { "$ref": "#/definitions/ingredient" }
    },
    "steps": {
      "type": "array",
      "minItems": 1,
      "items": { "$ref": "#/definitions/step" }
    },
    "notes": {
      "type": ["string", "null"],
      "description": "The headnote, printed above the ingredients the way a cookbook prints it \u2014 where the dish comes from, when to make it, what can be substituted, the one tip that decides whether it works. Two to four sentences of prose, not a summary of the steps. Write it last, once the whole recipe is on the page. Omit it only when there is genuinely nothing to say."
    },
    "image_query": {
      "type": ["string", "null"],
      "maxLength": 60,
      "description": "Two to four words for what the finished dish LOOKS like, written the way you would type it into a stock photo search box \u2014 the food, its form, and at most one visible quality: \"rustic focaccia bread\", \"creamy mushroom pasta\", \"chocolate layer cake slice\". Not the recipe's title, not a cuisine, not a person's or brand's name, nothing about taste, difficulty or occasion, nothing a camera cannot see. A dish's common name is fine where a photographer would tag the photo with it: \"victoria sponge cake\", \"pad thai\". The app searches a photo library with this string, so words a photographer would use beat words a cook would."
    },
    "image_urls": {
      "type": "array",
      "maxItems": 3,
      "items": { "type": "string", "pattern": "^(https|mise)://" },
      "description": "Left to the app. It holds the one photo the cook settled on, or a mise:// photo off their device. Do not emit it: a url you supply overrides the photo search and is usually a 404. Describe the dish in image_query instead. https only \u2014 phones block cleartext http."
    },
    "tags": {
      "type": "array",
      "items": { "type": "string", "minLength": 1 }
    },
    "source": { "type": "string", "minLength": 1 },
    "created_at": { "type": "string", "format": "date-time" }
  },
  "definitions": {
    "ingredient": {
      "type": "object",
      "additionalProperties": false,
      "required": ["id", "name", "amount", "unit"],
      "properties": {
        "id": {
          "type": "string",
          "pattern": "^[0-9]{4}$",
          "description": "4-char id referenced from step content as {0001}"
        },
        "name": {
          "type": "string",
          "minLength": 1,
          "description": "Counting noun folded in for whole items, e.g. 'garlic cloves'"
        },
        "amount": { "type": "number", "exclusiveMinimum": 0 },
        "unit": {
          "type": ["string", "null"],
          "enum": [
            "g",
            "kg",
            "ml",
            "l",
            "tsp",
            "tbsp",
            "cup",
            "fl_oz",
            "oz",
            "lb",
            "pinch",
            null
          ],
          "description": "null for whole/countable items"
        },
        "density_g_per_ml": {
          "type": ["number", "null"],
          "minimum": 0.1,
          "maximum": 2.0,
          "description": "Grams per millilitre, for ingredients genuinely measurable both ways. Spooned and levelled, not packed: flour 0.53, granulated sugar 0.85, brown sugar 0.93, water 1.0, milk 1.03, oil 0.92, honey 1.42, cocoa 0.51, butter 0.91. Omit for countable items, pinches, and anything only ever measured one way."
        }
      }
    },
    "step": {
      "type": "object",
      "additionalProperties": false,
      "required": ["id", "title", "content", "timer_seconds"],
      "properties": {
        "id": { "type": "string", "minLength": 1 },
        "title": { "type": "string", "minLength": 1 },
        "content": {
          "type": "string",
          "minLength": 1,
          "description": "References ingredients inline via {ingredient_id}, e.g. {0001}"
        },
        "timer_seconds": {
          "type": ["integer", "null"],
          "minimum": 1,
          "description": "Set whenever the step involves waiting: proofing, baking, resting, chilling, simmering \u2014 and for timed cooking on the stove, like browning or reducing. Not for hands-on work like whisking, creaming or kneading."
        }
      }
    }
  }
}
